{
  "version": "1.0.0",
  "timestamp": "2024-01-15T15:45:20.456Z",
  "pipeline": {
    "runId": "20240115.4",
    "buildNumber": "124",
    "repository": {
      "name": "template-samples",
      "branch": "feature/python-improvements",
      "commit": "def456abc123789012345678901234567890cdef"
    },
    "agent": {
      "name": "ubuntu-latest",
      "os": "Linux"
    }
  },
  "language": "python",
  "configuration": {
    "preBuildSteps": [
      "pip install -r requirements.txt"
    ],
    "validateSteps": [
      "python -m py_compile *.py"
    ],
    "dependencyUpdateCommand": "pip list --outdated"
  },
  "validation": {
    "summary": {
      "total": 4,
      "passed": 3,
      "failed": 1,
      "skipped": 0,
      "duration": 67.3
    },
    "samples": [
      {
        "name": "chat-completion",
        "path": "generated-samples/python/chat-completion",
        "status": "passed",
        "timestamp": "2024-01-15T15:45:25.123Z",
        "duration": 15.2,
        "configuration": {
          "preBuildSteps": [
            "pip install -r requirements.txt"
          ],
          "validateSteps": [
            "python -m py_compile *.py"
          ]
        },
        "buildSteps": [
          {
            "command": "pip install -r requirements.txt",
            "status": "success",
            "duration": 12.8,
            "exitCode": 0,
            "stdout": "Collecting openai==1.3.0\n  Using cached openai-1.3.0-py3-none-any.whl\nInstalling collected packages: openai\nSuccessfully installed openai-1.3.0",
            "stderr": ""
          }
        ],
        "validationSteps": [
          {
            "command": "python -m py_compile *.py",
            "status": "success",
            "duration": 2.4,
            "exitCode": 0,
            "stdout": "",
            "stderr": ""
          }
        ],
        "artifacts": [
          {
            "name": "compiled-bytecode",
            "path": "__pycache__/",
            "type": "binary",
            "size": 8192
          }
        ]
      },
      {
        "name": "embeddings",
        "path": "generated-samples/python/embeddings",
        "status": "passed",
        "timestamp": "2024-01-15T15:45:40.456Z",
        "duration": 14.9,
        "configuration": {
          "preBuildSteps": [
            "pip install -r requirements.txt"
          ],
          "validateSteps": [
            "python -m py_compile *.py"
          ]
        },
        "buildSteps": [
          {
            "command": "pip install -r requirements.txt",
            "status": "success",
            "duration": 12.3,
            "exitCode": 0,
            "stdout": "Requirement already satisfied: openai==1.3.0 in /usr/local/lib/python3.11/site-packages",
            "stderr": ""
          }
        ],
        "validationSteps": [
          {
            "command": "python -m py_compile *.py",
            "status": "success",
            "duration": 2.6,
            "exitCode": 0,
            "stdout": "",
            "stderr": ""
          }
        ],
        "artifacts": [
          {
            "name": "compiled-bytecode",
            "path": "__pycache__/",
            "type": "binary",
            "size": 7864
          }
        ]
      },
      {
        "name": "audio-transcription",
        "path": "generated-samples/python/audio-transcription",
        "status": "passed",
        "timestamp": "2024-01-15T15:45:55.789Z",
        "duration": 16.1,
        "configuration": {
          "preBuildSteps": [
            "pip install -r requirements.txt"
          ],
          "validateSteps": [
            "python -m py_compile *.py",
            "flake8 *.py --max-line-length=120"
          ]
        },
        "buildSteps": [
          {
            "command": "pip install -r requirements.txt",
            "status": "success",
            "duration": 13.1,
            "exitCode": 0,
            "stdout": "Requirement already satisfied: openai==1.3.0 in /usr/local/lib/python3.11/site-packages",
            "stderr": ""
          }
        ],
        "validationSteps": [
          {
            "command": "python -m py_compile *.py",
            "status": "success",
            "duration": 2.2,
            "exitCode": 0,
            "stdout": "",
            "stderr": ""
          },
          {
            "command": "flake8 *.py --max-line-length=120",
            "status": "success",
            "duration": 0.8,
            "exitCode": 0,
            "stdout": "",
            "stderr": ""
          }
        ],
        "artifacts": [
          {
            "name": "compiled-bytecode",
            "path": "__pycache__/",
            "type": "binary",
            "size": 9421
          },
          {
            "name": "lint-report",
            "path": "flake8.log",
            "type": "log",
            "size": 0
          }
        ]
      },
      {
        "name": "image-generation-async",
        "path": "generated-samples/python/image-generation-async",
        "status": "failed",
        "timestamp": "2024-01-15T15:46:11.012Z",
        "duration": 21.1,
        "configuration": {
          "preBuildSteps": [
            "pip install -r requirements.txt"
          ],
          "validateSteps": [
            "python -m py_compile *.py"
          ]
        },
        "buildSteps": [
          {
            "command": "pip install -r requirements.txt",
            "status": "success",
            "duration": 13.8,
            "exitCode": 0,
            "stdout": "Requirement already satisfied: openai==1.3.0 in /usr/local/lib/python3.11/site-packages",
            "stderr": ""
          }
        ],
        "validationSteps": [
          {
            "command": "python -m py_compile *.py",
            "status": "failed",
            "duration": 7.3,
            "exitCode": 1,
            "stdout": "",
            "stderr": "  File \"main.py\", line 23\n    async def generate_image(\n    ^\nSyntaxError: invalid syntax",
            "errorDetails": {
              "type": "SyntaxError",
              "message": "Invalid async function syntax",
              "location": {
                "file": "main.py",
                "line": 23,
                "column": 5
              }
            }
          }
        ],
        "artifacts": [
          {
            "name": "error-log",
            "path": "error.log",
            "type": "log",
            "size": 234
          }
        ]
      }
    ]
  },
  "history": {
    "previousRuns": [
      {
        "runId": "20240115.3",
        "timestamp": "2024-01-15T14:30:45.123Z",
        "passed": 3,
        "failed": 1,
        "duration": 52.4
      },
      {
        "runId": "20240115.2",
        "timestamp": "2024-01-15T12:15:30.456Z",
        "passed": 4,
        "failed": 0,
        "duration": 48.9
      }
    ],
    "trends": {
      "successRate": 0.85,
      "averageDuration": 56.2,
      "failingPatterns": [
        {
          "samplePattern": "*async*",
          "frequency": 1,
          "lastFailure": "2024-01-15T15:46:11.012Z"
        }
      ]
    }
  },
  "metadata": {
    "generatedBy": "validate-samples.sh",
    "generatedAt": "2024-01-15T15:46:32.345Z",
    "environment": {
      "variables": {
        "PYTHON_VERSION": "3.11.0",
        "BUILD_BUILDNUMBER": "124",
        "BUILD_SOURCEBRANCHNAME": "feature/python-improvements"
      },
      "tools": {
        "python": "3.11.0",
        "pip": "23.3.1",
        "flake8": "6.0.0",
        "node": "18.17.0",
        "caleuche": "1.2.3"
      }
    },
    "extensions": {
      "linting": {
        "enabled": true,
        "tools": ["flake8"],
        "maxLineLength": 120
      }
    }
  }
}